{
  "$schema": "https://json-schema.org/draft/2020-12/schema",
  "$id": "map-catalog.schema.json",
  "title": "Public map catalog",
  "description": "GET /maps/catalog.json (legacy providers) , /maps/catalog-v3.json (three providers), /maps/catalog-v4.json (four providers), and /maps/catalog-v5.json (adds OSMapaPL). All retain schemaVersion 2 and legacy aliases; unknown additive response fields are allowed.",
  "type": "object",
  "properties": {
    "schemaVersion": {
      "const": 2,
      "description": "Provider-neutral public payload shape. Not the Terento release number."
    },
    "catalogVersion": {
      "const": 1,
      "description": "Independent legacy map-catalog decoder contract version."
    },
    "updatedAt": {
      "type": "string"
    },
    "providers": {
      "type": "array",
      "items": {
        "$ref": "#/$defs/provider"
      }
    }
  },
  "required": [
    "schemaVersion",
    "catalogVersion",
    "updatedAt",
    "providers"
  ],
  "additionalProperties": true,
  "$defs": {
    "version": {
      "type": "object",
      "properties": {
        "year": {
          "type": "integer"
        },
        "month": {
          "type": "integer"
        },
        "day": {
          "type": "integer",
          "minimum": 1,
          "maximum": 31,
          "description": "Optional provider-native release day. Omitted for existing month-granularity providers; calendar validity is enforced by the adapter/client."
        }
      },
      "required": [
        "year",
        "month"
      ],
      "additionalProperties": true
    },
    "releaseMetadata": {
      "type": "object",
      "properties": {
        "releaseId": {
          "type": [
            "string",
            "null"
          ]
        },
        "versionLabel": {
          "type": [
            "string",
            "null"
          ]
        },
        "generatedAt": {
          "type": [
            "string",
            "null"
          ]
        },
        "sourceUpdatedAt": {
          "type": [
            "string",
            "null"
          ]
        }
      },
      "required": [
        "releaseId",
        "versionLabel",
        "generatedAt",
        "sourceUpdatedAt"
      ],
      "additionalProperties": true
    },
    "artifact": {
      "type": "object",
      "properties": {
        "id": {
          "type": "string"
        },
        "kind": {
          "type": "string"
        },
        "required": {
          "type": "boolean"
        },
        "sourceUrl": {
          "type": "string"
        },
        "sourceURL": {
          "type": "string"
        },
        "sizeBytes": {
          "type": [
            "integer",
            "null"
          ],
          "description": "Final Garmin image bytes when known; null means storage planning needs a measured image size."
        },
        "downloadSizeBytes": {
          "type": "integer",
          "description": "Provider download/archive bytes, not final installed image bytes."
        },
        "installSizeBytes": {
          "type": [
            "integer",
            "null"
          ],
          "description": "Final Garmin image bytes when known; null means storage planning needs a measured image size."
        },
        "checksumSha256": {
          "type": [
            "string",
            "null"
          ]
        },
        "checksum": {
          "type": [
            "string",
            "null"
          ]
        },
        "contentType": {
          "type": [
            "string",
            "null"
          ]
        },
        "validationStatus": {
          "type": "string"
        },
        "validationState": {
          "type": "string"
        }
      },
      "required": [
        "id",
        "kind",
        "required",
        "sourceUrl",
        "sourceURL",
        "sizeBytes",
        "downloadSizeBytes",
        "installSizeBytes",
        "checksumSha256",
        "checksum",
        "contentType",
        "validationStatus",
        "validationState"
      ],
      "additionalProperties": true
    },
    "map": {
      "type": "object",
      "properties": {
        "id": {
          "type": "string"
        },
        "region": {
          "type": "string"
        },
        "name": {
          "type": "string"
        },
        "country": {
          "type": [
            "string",
            "null"
          ]
        },
        "version": {
          "$ref": "#/$defs/version"
        },
        "sizeBytes": {
          "type": "integer",
          "description": "Legacy map-level download/package size; unlike artifact.sizeBytes this is not install size."
        },
        "downloadSizeBytes": {
          "type": "integer",
          "description": "Provider download/archive bytes, not final installed image bytes."
        },
        "installSizeBytes": {
          "type": [
            "integer",
            "null"
          ],
          "description": "Final Garmin image bytes when known; null means storage planning needs a measured image size."
        },
        "sourceURL": {
          "type": "string"
        },
        "sourceUrl": {
          "type": "string"
        },
        "releaseDate": {
          "type": [
            "string",
            "null"
          ]
        },
        "identifier": {
          "type": [
            "string",
            "null"
          ]
        },
        "providerRegionId": {
          "type": [
            "string",
            "null"
          ]
        },
        "canonicalRegionId": {
          "type": [
            "string",
            "null"
          ]
        },
        "countryCodes": {
          "type": "array",
          "items": {
            "type": "string"
          }
        },
        "regionKind": {
          "type": "string"
        },
        "tags": {
          "type": "array",
          "items": {
            "type": "string"
          }
        },
        "capabilities": {
          "type": "array",
          "items": {
            "type": "string"
          }
        },
        "release": {
          "type": "string",
          "description": "Provider release label, independent of app and API versions."
        },
        "availability": {
          "type": "string"
        },
        "releaseMetadata": {
          "$ref": "#/$defs/releaseMetadata"
        },
        "artifacts": {
          "type": "array",
          "items": {
            "$ref": "#/$defs/artifact"
          }
        },
        "mapType": {
          "type": [
            "string",
            "null"
          ],
          "enum": [
            "bbbike-latin1",
            "ontrail-latin1",
            "podstawowa",
            "ogonki",
            "light",
            "warstwice",
            null
          ],
          "description": "Independent BBBike or OSMapaPL map type; not a separate provider or contour component. OSMapaPL types are published only by catalog-v5."
        },
        "conflictGroup": {
          "type": [
            "string",
            "null"
          ],
          "pattern": "^osmapa-(podstawowa|ogonki|light|warstwice)$",
          "description": "OSMapaPL only (catalog-v5): packages in one group share a Garmin family ID and tiles, so at most one may be on a device. The client blocks the conflict and never deletes or replaces a file automatically."
        },
        "geographicRegionId": {
          "type": [
            "string",
            "null"
          ],
          "description": "Shared geographic identity; BBBike and OSMapaPL canonicalRegionId remains variant-specific lifecycle identity."
        },
        "downloadBlockReason": {
          "type": [
            "string",
            "null"
          ],
          "enum": [
            null,
            "PROVIDER_DOWN",
            "PROVIDER_PAUSED",
            "PROVIDER_RATE_LIMITED",
            "STATUS_STALE",
            "ADMIN_DISABLED",
            "PACKAGE_UNAVAILABLE"
          ],
          "description": "Current acquisition restriction. Null allows acquisition subject to all other policy and artifact checks. Maps remain visible; applies to Install and Update only."
        }
      },
      "required": [
        "id",
        "region",
        "name",
        "country",
        "version",
        "sizeBytes",
        "downloadSizeBytes",
        "installSizeBytes",
        "sourceURL",
        "sourceUrl",
        "releaseDate",
        "identifier",
        "providerRegionId",
        "canonicalRegionId",
        "countryCodes",
        "regionKind",
        "tags",
        "capabilities",
        "release",
        "artifacts"
      ],
      "additionalProperties": true
    },
    "provider": {
      "type": "object",
      "properties": {
        "id": {
          "type": "string"
        },
        "name": {
          "type": "string"
        },
        "adapterId": {
          "type": "string"
        },
        "status": {
          "type": "string"
        },
        "health": {
          "type": "string"
        },
        "lastCheckedAt": {
          "type": [
            "string",
            "null"
          ]
        },
        "lastSuccessfulCatalogSync": {
          "type": [
            "string",
            "null"
          ]
        },
        "website": {
          "type": [
            "string",
            "null"
          ]
        },
        "attribution": {
          "type": [
            "string",
            "null"
          ]
        },
        "licenseURL": {
          "type": [
            "string",
            "null"
          ]
        },
        "licenseInformation": {
          "type": [
            "string",
            "null"
          ]
        },
        "maps": {
          "type": "array",
          "items": {
            "$ref": "#/$defs/map"
          }
        },
        "downloadBlockReason": {
          "type": [
            "string",
            "null"
          ],
          "enum": [
            null,
            "PROVIDER_DOWN",
            "PROVIDER_PAUSED",
            "PROVIDER_RATE_LIMITED",
            "STATUS_STALE",
            "ADMIN_DISABLED",
            "PACKAGE_UNAVAILABLE"
          ],
          "description": "Current acquisition restriction. Null allows acquisition subject to all other policy and artifact checks. Maps remain visible; applies to Install and Update only."
        }
      },
      "required": [
        "id",
        "name",
        "adapterId",
        "status",
        "health",
        "website",
        "attribution",
        "licenseURL",
        "licenseInformation",
        "maps"
      ],
      "additionalProperties": true
    }
  }
}
